{
  "change_set_id": "cs-20260724-001",
  "request_id": "req-20260724-002",
  "source_ref": "del-ch012-draft-001@rev-ch012-draft-1",
  "base_revision": {
    "state/canon.md": "rev-canon-42",
    "state/timeline.md": "rev-timeline-18",
    "state/character_state.md": "rev-charstate-25",
    "state/knowledge_state.md": "rev-knowledge-12"
  },
  "target_updates": [
    {
      "target_file": "state/canon.md",
      "operation": "MODIFY",
      "content": "## Canon-043\n- statement: 林渊在秘境第三层突破灵脉封锁，修为达到凝气七层\n- source: { type: chapter, ref: chapters/drafts/chapter_012.md }\n- effective_from: chapter_012\n- status: CANON"
    },
    {
      "target_file": "state/character_state.md",
      "operation": "MODIFY",
      "content": "## 林渊\n- 修为: 凝气七层\n- 状态: 灵脉封锁解除，轻伤\n- 位置: 秘境第三层"
    },
    {
      "target_file": "state/chapter_summaries.md",
      "operation": "ADD",
      "content": "## 第12章摘要\n林渊在秘境第三层遭遇暗影宗伏击，生死压力下突破灵脉封锁至凝气七层，击退敌人后发现对方撤退有序，疑似背后有更大势力。"
    }
  ],
  "status": "COMMITTED",
  "created_at": "2026-07-24T15:00:00+08:00",
  "committed_at": "2026-07-24T15:00:05+08:00"
}
